{
    "$id": "https://w3id.org/pathogen/schemas/DGCSubject.json",
    "$schema": "http://json-schema.org/draft-07/schema#",
    "$comment": "{\"term\": \"DGCSubject\", \"@id\": \"https://w3id.org/pathogen#DGCSubject\"}",
    "title": "DGCSubject",
    "description": "Lab test information for vax.",
    "type": "object",
    "properties": {
        "@context": {
            "type": "array"
        },
        "type": {
            "oneOf": [
                {
                    "type": "string"
                },
                {
                    "type": "array"
                }
            ]
        },
        "familyName": {
          "$comment": "{\"term\": \"familyName\", \"@id\": \"http://hl7.eu/fhir/ig/dgc/Patient.name.familyName\"}",
          "title": "Family Name",
          "description": "Family name of the subject",
          "type": "string"
        },
        "givenName" : {
          "$comment": "{\"term\": \"givenName\", \"@id\": \"http://hl7.eu/fhir/ig/dgc/Patient.name.givenName\"}",
          "title": "Given Name",
          "description": "Given name of the subject",
          "type": "string"
        },
        "birthDate" : {
          "$comment": "{\"term\": \"birthDate\", \"@id\": \"http://hl7.eu/fhir/ig/dgc/Patient.birthDate\"}",
          "title": "Date of Birth",
          "description": "Subjects date of birth",
          "type": "string"
        },
        "gender" : {
          "$comment": "{\"term\": \"gender\", \"@id\": \"http://hl7.org/fhir/gender-identity\"}",
          "title": "Gender",
          "description" : "Gender of the subject",
          "type": "string"
        }

    },
    "additionalProperties": false,
    "examples": []
}
